<?xml version="1.0" encoding="UTF-8"?>
<!DOCTYPE Localization SYSTEM "local.dtd">
<Localization lang="">
    <locallist>
        <G_Language></G_Language>
        <G_Attention></G_Attention>
        <G_Error></G_Error>
        <G_Open></G_Open>
        <G_Save></G_Save>
        <G_Cancel></G_Cancel>
        <G_Yes></G_Yes>
        <G_No></G_No>
        <G_Ok></G_Ok>
        <G_AYouSure></G_AYouSure>
        <ACD_Title></ACD_Title>
        <ACD_PersonalNumber></ACD_PersonalNumber>
        <ACD_Name></ACD_Name>
        <ACD_Phone></ACD_Phone>
        <ACD_EMail></ACD_EMail>
        <ACD_Remember></ACD_Remember>
        <ACD_Password></ACD_Password>
        <ACD_RepeatPassword></ACD_RepeatPassword>
        <ACD_RedLighting></ACD_RedLighting>
        <ACD_ConsultantPresent></ACD_ConsultantPresent>
        <ACD_PasswordsNotCoincide></ACD_PasswordsNotCoincide>
        <LD_Title></LD_Title>
        <LD_Number></LD_Number>
        <LD_Password></LD_Password>
        <LD_Enter></LD_Enter>
        <LD_ConsultantNumberNotPoint></LD_ConsultantNumberNotPoint>
        <LD_IncorrectPassword></LD_IncorrectPassword>
        <LD_ConsultantNumberNotFound></LD_ConsultantNumberNotFound>
        <MM_1_Control></MM_1_Control>
        <MM_Config></MM_Config>
        <MM_AboutProgram></MM_AboutProgram>
        <MM_Exit></MM_Exit>
        <MM_2_Consultant></MM_2_Consultant>
        <MM_NewConsultant></MM_NewConsultant>
        <MM_Enter></MM_Enter>
        <MM_OtherConsultant></MM_OtherConsultant>
        <MM_ConfirmOtherConsultant></MM_ConfirmOtherConsultant>
        <NT_Clients></NT_Clients>
        <NT_Invoices></NT_Invoices>
        <NT_Catalogs></NT_Catalogs>
        <NT_Pricelist></NT_Pricelist>
        <NT_Reports></NT_Reports>
        <NT_Orders></NT_Orders>
        <NT_Contacts></NT_Contacts>
        <IP_Clients></IP_Clients>
        <IP_Catalogs></IP_Catalogs>
        <IP_Orders></IP_Orders>
        <IP_Invoices></IP_Invoices>
        <IP_Prices></IP_Prices>
        <IP_AddAction></IP_AddAction>
        <IP_DeleteAction></IP_DeleteAction>
        <IP_EditAction></IP_EditAction>
        <IP_FindAction></IP_FindAction>
        <IP_PreviewAction></IP_PreviewAction>
        <IP_PrintAction></IP_PrintAction>
        <IP_CatalogNumber></IP_CatalogNumber>
        <IP_CatalogGiveDate></IP_CatalogGiveDate>
        <IP_CatalogReturnDate></IP_CatalogReturnDate>
        <IP_CatalogReturned></IP_CatalogReturned>
        <IP_CatalogInfo></IP_CatalogInfo>
        <IP_ClientName></IP_ClientName>
        <IP_ClientPhone></IP_ClientPhone>
        <IP_ClientPhoneMob></IP_ClientPhoneMob>
        <IP_ClientAdress></IP_ClientAdress>
        <IP_ClientBirthday></IP_ClientBirthday>
        <IP_ClientOther></IP_ClientOther>
        <IP_ClientOtherDate></IP_ClientOtherDate>
        <IP_ClientStatus></IP_ClientStatus>
        <IP_ClientStatus_1></IP_ClientStatus_1>
        <IP_ClientStatus_2></IP_ClientStatus_2>
        <IP_ClientDiscount></IP_ClientDiscount>
        <IP_ClientIncorrectDiscountFormat></IP_ClientIncorrectDiscountFormat>
        <IP_ClientAdd></IP_ClientAdd>
        <IP_ClientEdit></IP_ClientEdit>
        <IP_OrderDate></IP_OrderDate>
        <IP_OrderQuantity></IP_OrderQuantity>
        <IP_InvoicesID></IP_InvoicesID>
        <IP_InvoicesOrdered></IP_InvoicesOrdered>
        <IP_InvoicesReceived></IP_InvoicesReceived>
        <IP_InvoicesPrice></IP_InvoicesPrice>
        <IP_InvoicesPoints></IP_InvoicesPoints>
        <IP_ProductID></IP_ProductID>
        <IP_ProductGetDate></IP_ProductGetDate>
        <IP_ProductGetPrice></IP_ProductGetPrice>
        <IP_ProductRealDate></IP_ProductRealDate>
        <IP_ProductRealPrice></IP_ProductRealPrice>
        <IP_EventsComing></IP_EventsComing>
        <IP_EventsCompletion></IP_EventsCompletion>
        <IP_EventsFixed></IP_EventsFixed>
        <IP_EventInfo></IP_EventInfo>
        <IP_ContactPhone></IP_ContactPhone>
        <IP_ContactWhereFind></IP_ContactWhereFind>
        <IP_ContactWhereFind_1></IP_ContactWhereFind_1>
        <IP_ContactWhereFind_2></IP_ContactWhereFind_2>
        <IP_ContactWhereFind_3></IP_ContactWhereFind_3>
        <IP_ContactWhereFind_4></IP_ContactWhereFind_4>
        <IP_ContactName></IP_ContactName>
        <IP_ContactDate></IP_ContactDate>
        <IP_ContactStatus></IP_ContactStatus>
        <IP_Contact></IP_Contact>
    </locallist>
</Localization>
